<?xml version="1.0" encoding="UTF-8"?>
<xs:schema
    xmlns:xs="http://www.w3.org/2001/XMLSchema"
    elementFormDefault ="qualified" >
    <xs:element name="bookmarks">
        <xs:complexType>
            <xs:sequence>
                <xs:element name="page" maxOccurs="unbounded"/>
                    <xs:complexType>
                        <xs:sequence>
                            <xs:element name="name" type="xs:string" />
                            <xs:element name="description" type="xs:string" />
                            <xs:element name="url" type="xs:string" />
                        </xs:sequence>
                    </xs:complexType>
            </xs:sequence>
        </xs:complexType>
    </xs:element>
</xs:schema>